{"schema_version":"0.2","record_type":"evidence_metadata","record_id":"evidence-alpha-current","created_at":"2026-01-01T00:00:00Z","evidence_id":"evidence-alpha-current","subject_ref":{"subject_id":"subject-alpha","subject_type":"synthetic-service","subject_version":"1.0"},"validation_scope":{"subject_identity":{"subject_id":"subject-alpha","subject_type":"synthetic-service","subject_version":"1.0"},"claim_refs":["claim:available"],"state_domains":["execution"],"environment_class":"isolated_test","version_constraints":["1.0"],"time_window":{"start":"2026-01-01T00:00:00Z","end":"2026-01-02T00:00:00Z"},"scope_limitations":[]},"provenance":{"source_type":"test_result","producer_type":"tool","source_ref":"source:synthetic-suite","collected_at":"2026-01-01T00:00:00Z","collection_method_ref":"method:conformance"},"observed_at":"2026-01-01T00:00:00Z","validation_method":{"method_id":"method:conformance","method_version":"1","result":"pass"},"evidence_state":"current","freshness":{"evaluated_at":"2026-01-01T00:00:00Z","valid_until":"2026-01-02T00:00:00Z"},"privacy_classification":"public","payload_handling":"synthetic_public","review_triggers":[{"trigger_type":"time_elapsed","condition":"revalidate"}],"relationships":{"supersedes":[],"superseded_by":[],"corrects":[],"corrected_by":[],"derived_from":[]},"claim_refs":["claim:available"]}
