{"schema_version":"0.2","record_type":"evidence_metadata","record_id":"evidence-alpha-correction","created_at":"2026-01-02T00:00:00Z","evidence_id":"evidence-alpha-correction","subject_ref":{"subject_id":"subject-alpha","subject_type":"synthetic-service"},"validation_scope":{"subject_identity":{"subject_id":"subject-alpha","subject_type":"synthetic-service"},"claim_refs":["claim:available"],"state_domains":["execution"],"environment_class":"isolated_test","version_constraints":["1.0"],"time_window":{"start":"2026-01-02T00:00:00Z"},"scope_limitations":[]},"provenance":{"source_type":"derived","producer_type":"mixed","source_ref":"source:synthetic-correction","collected_at":"2026-01-02T00:00:00Z","collection_method_ref":"method:correction-review"},"observed_at":"2026-01-02T00:00:00Z","validation_method":{"method_id":"method:correction-review","method_version":"1","result":"pass"},"evidence_state":"corrected","freshness":{"evaluated_at":"2026-01-02T00:00:00Z"},"privacy_classification":"public","payload_handling":"synthetic_public","review_triggers":[{"trigger_type":"new_conflicting_evidence","condition":"retain-chain"}],"relationships":{"supersedes":[],"superseded_by":[],"corrects":["evidence-alpha-original"],"corrected_by":[],"derived_from":["evidence-alpha-original"]},"claim_refs":["claim:available"]}
