{"schema_version":"0.2","record_type":"evidence_metadata","record_id":"evidence-synthetic-public","created_at":"2026-01-01T00:00:00Z","evidence_id":"evidence-synthetic-public","subject_ref":{"subject_id":"subject-demo","subject_type":"synthetic-record"},"validation_scope":{"subject_identity":{"subject_id":"subject-demo","subject_type":"synthetic-record"},"claim_refs":["claim:fixture-safe"],"state_domains":["evidence"],"environment_class":"isolated_test","version_constraints":["0.2"],"time_window":{"start":"2026-01-01T00:00:00Z"},"scope_limitations":["synthetic-only"]},"provenance":{"source_type":"document","producer_type":"agent","source_ref":"source:generated-fixture","collected_at":"2026-01-01T00:00:00Z","collection_method_ref":"method:fixture-generation"},"observed_at":"2026-01-01T00:00:00Z","validation_method":{"method_id":"method:fixture-review","method_version":"1","result":"pass"},"evidence_state":"current","freshness":{"evaluated_at":"2026-01-01T00:00:00Z"},"privacy_classification":"public","payload_handling":"synthetic_public","review_triggers":[{"trigger_type":"version_changed","condition":"regenerate"}],"relationships":{"supersedes":[],"superseded_by":[],"corrects":[],"corrected_by":[],"derived_from":[]},"claim_refs":["claim:fixture-safe"],"license_provenance":{"source_class":"generated_synthetic","usage_basis":"project_test_fixture"}}
